one_menu_meal_id,one_menu_course_id,one_menu_id,title,main_theme,sub_theme,release_date,release_status,created_id,created_at,updated_id,updated_at,admin_note,shoppinglist_remarks,precooking_remarks,cooking_remarks,one_day_schedule_algorithm,pre_cooking_schedule_algorithm,cooking_schedule_algorithm
188,1,188,鯖の甘酢から揚げ献立,カラリと揚げた鯖に甘酢を絡めて、さっぱりといただきます。,"",2015-12-17,2,1,2014-04-10 00:00:00,1,2016-11-11 00:00:00,,,,,,,
191,1,191,ブリのカレーソテー献立,ブリは、カレー粉と絡めスパイシーに仕上げます。ナスのあっさり漬けでさっぱりと合わせます。,"",2016-03-21,2,1,2014-04-10 00:00:00,1,2016-11-11 00:00:00,,,,,,,
206,1,206,簡単で美味しい鰯のかば焼き献立,照りたれでしっかり絡めた鰯を焼くだけ！ナスとイカの生姜ソースでさっぱりと,"",2016-02-29,2,1,2014-04-10 00:00:00,1,2016-11-11 00:00:00,,,,,,,
220,1,220,四川風牛肉串焼きとビーフン献立,牛肉串焼きは、山椒と唐辛子でピリ辛風。野菜たっぷりビーフンと共に,"",2016-02-18,2,1,2014-04-10 00:00:00,1,2016-11-11 00:00:00,,,,,,,
226,1,226,鶏ごぼうつくね献立,豆腐が入っているのでふわふわの食感が楽しめますよ！大人から子供までみんな大好き,"",2015-12-17,2,1,2014-04-10 00:00:00,1,2016-11-11 00:00:00,,,,,,,
240,1,240,グリルで作るプルコギとビーフン献立,プルコギの材料を混ぜ合わせグリル皿に乗せて焼くだけ！ジューシーで美味しい,"",2016-04-15,2,1,2014-04-10 00:00:00,1,2016-11-11 00:00:00,,,,,,,
246,1,246,ポテトとタラのパリパリ包み焼き献立,ほくほくポテトとタラの相性は抜群！春巻きの皮でくるんでグリルで焼くだけ！春菊のサラダと合わせて,"",2016-02-17,2,1,2014-04-10 00:00:00,1,2016-11-11 00:00:00,,,,,,,
247,1,247,さんまの塩焼きと里芋イカの煮物献立,さんまをグリルで焼いている間に、里芋とイカの煮物をstillたれで煮こむだけ、簡単美味しい！,"",2016-03-05,2,1,2014-04-10 00:00:00,1,2016-11-11 00:00:00,,,,,,,
248,1,248,甘辛たれで旨みUP！から揚げ献立,カリッと揚げたから揚げに、甘辛たれを絡めればジューシーさが際立ちます。レモンの酸味がきいたコールスローと合わせて,"",2016-01-27,2,1,2014-04-10 00:00:00,1,2016-11-11 00:00:00,,,,,,,
250,1,250,ふわふわチキンボールと湯豆腐鍋,チキンボールはおからを入れてふんわりと揚げて。湯豆腐の漬け汁は、しょう油とstilたれで味もばっちり！,"",2016-02-27,2,1,2014-04-10 00:00:00,1,2016-11-11 00:00:00,,,,,,,
256,1,256,グリルで焼いて和える簡単エビマヨ献立,カリッと焼いた香ばしいエビを、ケチャップとマヨネースで和えて。かぶのサラダ漬けは作り置きにも最適,"",2016-01-29,2,1,2014-04-10 00:00:00,1,2016-11-11 00:00:00,,,,,,,
258,1,258,麻婆ナスと大根ツナのきんぴら献立,麻婆ナスと大根ツナのきんぴら、白菜スープと野菜たっぷりの献立です,"",2016-04-16,2,1,2014-04-10 00:00:00,1,2016-11-11 00:00:00,,,,,,,
262,1,262,油琳鶏とさっぱりサワー漬け献立,カリッと揚げた鶏肉には、甘酸っぱいソースがよく合います。セロリ、人参、きゅうりのサワー漬けでさっぱりと,"",2016-02-09,2,1,2014-04-10 00:00:00,1,2016-11-11 00:00:00,,,,,,,
264,1,264,stillたれで簡単！牛丼献立,stillたれがあれば牛丼も簡単！しょう油とstillたれを加えるだけ！ふろふき大根は、レンジで,"",2016-02-14,2,1,2014-04-10 00:00:00,1,2016-11-11 00:00:00,,,,,,,
273,1,273,万能肉味噌スピード献立,万能肉味噌は作り置きしておけば、野菜炒めや麺類のトッピングにも使えて便利。時間の無い時のスピード献立。,"",2016-02-10,2,1,2014-04-10 00:00:00,1,2016-11-11 00:00:00,,,,,,,
274,1,274,タラとポテトのクリームグラタン献立,淡白な白身魚に濃厚クリーミーなホワイトソースは良くあいます。副菜は、セロリとリンゴのサラダでさっぱりと,"",2016-01-30,2,1,2014-04-10 00:00:00,1,2016-11-11 00:00:00,,,,,,,
281,1,281,ビールのお供に、チキンバー＆ポテト献立,下味しっかりつけて揚げるだけ、ポテトと一緒に、ビールのお供にも最高！,"",2016-03-01,2,1,2014-04-10 00:00:00,1,2016-11-11 00:00:00,,,,,,,
282,1,282,和食の定番！カレイのから揚げ献立,からりと揚げたカレイはポン酢でさっぱりといただきます。色どりも栄養バランス良い三色野菜の卵炒めを合わせて,"",2016-01-31,2,1,2014-04-10 00:00:00,1,2016-11-11 00:00:00,,,,,,,
283,1,283,焼き粉チーズが香ばしいチーズカツレツ献立,香ばしいチーズとジューシーなカツの組み合わせが美味しいチーズカツレツ。リンゴとセロリのサラダでさっぱりと。,"",2016-03-04,2,1,2014-04-10 00:00:00,1,2016-11-11 00:00:00,,,,,,,
284,1,284,お肉と合わせてジューシー椎茸の肉詰め献立,椎茸に生姜、しょう油で味付けした鶏ミンチを乗せてグリルで焼くだけ。たこ飯は、炊飯器で炊けるのでとっても簡単！,"",2016-03-26,2,1,2014-04-10 00:00:00,1,2016-11-11 00:00:00,,,,,,,
285,1,285,豚ときのこのオイスター炒め丼献立,舞茸の旨みと豚ばら肉が混ざり合い美味しい！ごはんに乗せて丼にしていただきます。,"",2016-03-27,2,1,2014-04-10 00:00:00,1,2016-11-11 00:00:00,,,,,,,
292,1,292,白身魚のレモンバター焼きとトマトスープ,白身魚は野菜、エビと一緒にバター＆レモンを乗せてホイルに包んでグリルで焼くだけ！その間にトマトスープを作ります,"",2016-04-02,2,1,2014-04-10 00:00:00,1,2016-11-11 00:00:00,,,,,,,
293,1,293,レンジで簡単!キャベツと豚の蒸し煮献立,蒸し煮はレンジで簡単!その間に、ほうれん草を薄焼き玉子で巻いて出来上がり!,"",2016-01-26,2,1,2014-04-10 00:00:00,1,2016-11-11 00:00:00,,,,,,,
296,1,296,おから入りヘルシーハンバーグ献立,おから入りだからヘルシーなのにボリューム満点、春菊のサラダと共に,"",2016-03-02,2,1,2014-04-10 00:00:00,1,2016-11-11 00:00:00,,,,,,,
299,1,299,エビ入りトマトのクリームパスタ献立,パスタのソースをレンジでチンしている間に、パスタを茹でてサラダをつくります。簡単で美味しい,"",2016-02-22,2,1,2014-04-10 00:00:00,1,2016-11-11 00:00:00,,,,,,,
306,1,306,サーモンのハーブグリル献立,サーモンはハーブとにんにくと一緒にグリルして華やかな味わいに,"",2016-02-19,2,1,2014-04-10 00:00:00,1,2016-11-11 00:00:00,,,,,,,
308,1,308,豚肉の長芋梅巻き献立,長芋と梅を豚肉でくるっと巻いて蒸し煮します。stillたれを加え照り焼きにすればお弁当のおかずにも最適！,"",2016-01-28,2,1,2014-04-10 00:00:00,1,2016-11-11 00:00:00,,,,,,,
320,1,320,豚ときのこのオイスター炒め丼献立,豚肉は、きのこと一緒に炒めて旨みＵＰ！こってり味で白ご飯がすすみます,"",2016-02-07,2,1,2014-04-10 00:00:00,1,2016-11-11 00:00:00,,,,,,,
10928,1,17302,麻婆豆腐献立,定番の麻婆豆腐を手作りします。ご飯がすすみますよ,"",2017-08-15,2,11,2017-07-06 17:00:34,11,2017-08-01 09:51:12,"","","","",,,
325,1,325,stillたれで作る親子丼と小松菜の煮物,定番人気の親子丼も、stillたれがあれば、ばっちり味が決まります。小松菜と厚揚げの煮物と一緒に,"",2016-02-02,2,1,2014-04-10 00:00:00,1,2016-11-11 00:00:00,,,,,,,
349,1,349,鶏の照り焼きアボカ丼と若竹汁の献立,照り焼きにした鶏と熟したアボカドの相性抜群！若竹汁と共に,"",2016-03-20,2,1,2014-04-10 00:00:00,1,2016-11-11 00:00:00,,,,,,,
365,1,365,ホークピカタと春菊のサラダ献立,チーズを挟んだジューシーなポークピカタは、春菊とご一緒に,"",2016-02-25,2,1,2014-04-10 00:00:00,1,2016-11-11 00:00:00,,,,,,,
368,1,368,きゅうりと豚しゃぶのサラダ献立,少しづつ暑くなってきたらきゅうりと冷しゃぶのサラダでさっぱりといただきます,"",2016-05-03,2,1,2014-04-10 00:00:00,1,2016-11-11 00:00:00,,,,,,,
378,1,378,簡単たこ飯といんげんのそぼろ炒め献立,たこ飯は出汁と調味料を入れて炊飯器に入れるだけ！いんげんのそぼろ炒めと共に,"",2016-03-03,2,1,2014-04-10 00:00:00,1,2016-11-11 00:00:00,,,,,,,
382,1,382,ピリ辛が美味しいブリの豆板醤焼き,ブリの照り焼きに豆板醤を加えていつもと違う味に。ほうれんそうとしめじの中華炒めをそえて,"",2016-02-08,2,1,2014-04-10 00:00:00,1,2016-11-11 00:00:00,,,,,,,
392,1,392,えのき梅肉和えと鯖漬け焼きのスピード献立,漬け鯖をグリルで焼いている間に、えのき梅肉和えはレンジでスピード仕上げ！,"",2016-02-12,2,1,2014-04-10 00:00:00,1,2016-11-11 00:00:00,,,,,,,
394,1,394,しし唐の豚肉巻きとじゃこ梅ご飯献立,しし唐の豚肉巻きはお弁当のおかずにも大活躍！じゃこと梅の混ぜご飯と共に,"",2016-03-09,2,1,2014-04-10 00:00:00,1,2016-11-11 00:00:00,,,,,,,
402,1,402,豆腐ステーキトマトソースかけ献立,煮こみトマトソースは、木綿豆腐、チーズと良く合います。あさりとじゃがいもの組合せも抜群！,"",2016-03-23,2,1,2014-04-10 00:00:00,1,2016-11-11 00:00:00,,,,,,,
403,1,403,お弁当にも美味しい！長芋の肉巻献立,しっかり味の長芋の豚肉巻きはお弁当のおかずにもぴったり！じゃことしし唐はレンジで簡単！,"",2016-02-16,2,1,2014-04-10 00:00:00,1,2016-11-11 00:00:00,,,,,,,
410,1,410,レタス炊飯と酸辣湯献立,レタス炒飯ではレタスをたっぷりと。白ネギ、人参、椎茸と野菜類がたっぷり摂取できる献立です,"",2016-03-13,2,1,2014-04-10 00:00:00,1,2016-11-11 00:00:00,,,,,,,
412,1,412,鶏手羽中のグリルと三色野菜の卵炒め献立,鶏手羽はstillたれと絡めてこんがり焼くだけ！ほうれん草と人参、もやしの卵炒めでバランスばっちり！,"",2016-03-31,2,1,2014-04-10 00:00:00,1,2016-11-11 00:00:00,,,,,,,
417,1,417,野菜たっぷりヘルシー焼きそば献立,ニラ、人参、セロリ、きゅうり、もやしと野菜がたっぷり美味しく食べれる献立です,"",2016-02-24,2,1,2014-04-10 00:00:00,1,2016-11-11 00:00:00,,,,,,,
421,1,421,パリパリ鰺フライが美味しい献立,塩こしょうで味付けした鰺をぱりっと揚げて。レモンを絞っても美味しい！ニラ玉、トマトスープと共に,"",2016-02-15,2,1,2014-04-10 00:00:00,1,2016-11-11 00:00:00,,,,,,,
427,1,427,かますの塩焼きとほうれん草ちくわ炒め献立,塩焼きかますは、ほうれん草と人参とちくわの炒め物とご一緒に,"",2016-02-26,2,1,2014-04-10 00:00:00,1,2016-11-11 00:00:00,,,,,,,
429,1,429,明太子パスタとかぼちゃスープ献立,明太子パスタはフライパン1つでできて簡単！かぼちゃスープと共に,"",2016-03-29,2,1,2014-04-10 00:00:00,1,2016-11-11 00:00:00,,,,,,,
430,1,430,鮭のから揚げサラダとじゃがバタ献立,パリッと揚げた鮭の唐揚げに甘酢ドレッシングと絡めてさっぱりと。ほくほくじゃがいもバター焼きと一緒に,"",2016-02-21,2,1,2014-04-10 00:00:00,1,2016-11-11 00:00:00,,,,,,,
431,1,431,鶏の照り焼きごま風味献立,胡麻の風味が美味しい鶏の照り焼きときゅうりの酢の物でさっぱりと,"",2016-02-20,2,1,2014-04-10 00:00:00,1,2016-11-11 00:00:00,,,,,,,
436,1,436,鶏照りアボカド丼献立,アボカドと鶏肉の相性は抜群！簡単で美味しい,"",2016-06-12,2,1,2014-04-10 00:00:00,1,2016-11-11 00:00:00,,,,,,,
450,1,450,おからハンバーグ献立,おからでボリュームアップだけどヘルシーなハンバーグ。ふんわり食感が美味しい。きゅうりのからし漬けと共に,"",2016-03-30,2,1,2014-04-10 00:00:00,1,2016-11-11 00:00:00,,,,,,,
451,1,451,ジューシー油琳鶏献立,カラリと揚げた鶏肉は、酢しょう油とネギでさっぱりといただきます,"",2016-06-14,2,1,2014-04-10 00:00:00,1,2016-11-11 00:00:00,,,,,,,
453,1,453,鮭の照り焼きとソラマメ豚ロースサラダ献立,鮭の照り焼きはstillたれに漬けて焼くだけ。今が旬なソラマメのサラダとご一緒に,"",2016-06-17,2,1,2014-04-10 00:00:00,1,2016-11-11 00:00:00,,,,,,,
454,1,454,キャベツと豚バラの蒸し煮献立,"キャベツはカットして豚バラ、ベーコンと共にレンジで加熱するだけ！その間にフライパンで大根とツナのきんぴらを作ります
","",2016-06-18,2,1,2014-04-10 00:00:00,1,2016-11-11 00:00:00,,,,,,,
489,1,489,こんがりポテトのポークサラダ献立,こんがりと焼いたポテトと豚の相性は抜群！サラダ仕立てのメインで、2品でもボリュームも栄養も満点！,"",2016-02-11,2,1,2014-04-10 00:00:00,1,2016-11-11 00:00:00,,,,,,,
505,1,505,太刀魚の山椒ソースとゴーヤの佃煮献立,山椒とセロリのソースが淡白な太刀魚を引き立てます。ゴーヤの佃煮を添えて,"",2016-07-06,2,1,2014-04-10 00:00:00,1,2016-11-11 00:00:00,,,,,,,
509,1,509,オムライスと水菜とあげのサラダ献立,ベーシックな、ケチャップ味のオムライスはどこか懐かしい味がします。副菜は水菜とあげでさっぱりといただきます,"",2015-12-17,2,1,2014-04-10 00:00:00,1,2016-11-11 00:00:00,,,,,,,
518,1,518,鶏肉の黒酢炒め献立,鶏肉はstillたれと黒酢に漬けこんでおきます。しっかり味が浸みこんだ鶏肉と野菜が絡みあってとっても美味しい！,"",2015-12-17,2,1,2014-04-10 00:00:00,1,2016-11-11 00:00:00,,,,,,,
524,1,524,ジューシーポークステーキ献立,脂ののったポークステーキは、玉ねぎ、生姜、にんにくの擦りおろしソースでさっぱりといただきます,"",2016-02-05,2,1,2014-04-10 00:00:00,1,2016-11-11 00:00:00,,,,,,,
529,1,529,鶏むね肉で作るヘルシーチキンナゲット献立,チキンナゲットは鶏むね肉から作るからとってもヘルシーで美味しい！プロッコリーとアスパラのサラダを添えて,"",2016-04-03,2,1,2014-04-10 00:00:00,1,2016-11-11 00:00:00,,,,,,,
531,1,531,チキンのトマト煮献立,トマトと鶏肉は相性抜群！鶏肉は、フライパンやグリルで表面をカリッとさせるのがポイント！,"",2015-12-17,2,1,2014-04-10 00:00:00,1,2016-11-11 00:00:00,,,,,,,
533,1,533,鯖のきのこおろし献立,焼き鯖に焼きしめじをのせてポン酢でさっぱりと。いんげんのそぼろ炒めとご一緒に,"",2016-05-04,2,1,2014-04-10 00:00:00,1,2016-11-11 00:00:00,,,,,,,
535,1,535,マグロとアボカドのスピード献立,マグロのしょう油漬けと熟したアボカドを和えて寿司飯に乗せるだけ。きゅうり昆布と合わせれば、簡単ヘルシー！,"",2016-02-03,2,1,2014-04-10 00:00:00,1,2016-11-11 00:00:00,,,,,,,
538,1,538,簡単リメイク！和風だけどクリーミーなポテトグラタン,レンジで作るポテトとベーコンの煮物をグラタンにアレンジ！じゃがいもを冷凍ポテトにすればさらに簡単！,"",2016-02-04,2,1,2014-04-10 00:00:00,1,2016-11-11 00:00:00,,,,,,,
542,1,542,ブリのカレー風味照り焼き献立,脂の乗ったブリに、stillたれとカレー粉を絡めてカリッと焼きます。カレー粉の香りが食欲をそそります,"",2016-02-13,2,1,2014-04-10 00:00:00,1,2016-11-11 00:00:00,,,,,,,
550,1,550,出汁がおいしい里芋ごはん献立,しっかり出汁のしみこんだほくほくの里芋ご飯が美味しい。蒸し鶏は、白味噌とマヨネースで合えて,"",2016-02-28,2,1,2014-04-10 00:00:00,1,2016-11-11 00:00:00,,,,,,,
551,1,551,低カロリー鶏ささみの梅巻き献立,高タンパクだけど低カロリーなささみは、ダイエットしたい人にもおすすめ。大根とツナのきんぴらとと共に,"",2016-02-01,2,1,2014-04-10 00:00:00,1,2016-11-11 00:00:00,,,,,,,
562,1,562,鮭の照り焼き簡単ヘルシー献立,たれに漬け置きした鮭を焼いている間に、水菜のサラダを作ります。納豆おろしも1品加え簡単ヘルシー,"",2016-02-06,2,1,2014-04-10 00:00:00,1,2016-11-11 00:00:00,,,,,,,
572,1,572,カレイの煮つけとほうれん草卵巻き献立,stillたれとだしで煮こんだカレイの煮つけが美味しい。ほうれん草の卵巻きと合わせて,"",2016-02-23,2,1,2014-04-10 00:00:00,1,2016-11-11 00:00:00,,,,,,,
632,1,632,アスパラとベーコンのパスタ献立,アスパラとベーコンのパスタは、パスタと一緒に野菜と茹でるだけ、最後に生クリームとバターを加えて。簡単で美味しい,,2016-03-06,2,1,2014-04-10 00:00:00,1,2016-11-11 00:00:00,,,,,,,
634,1,634,豚の生姜焼きと菜の花のごま豆腐かけ献立,生姜と玉ねぎ擦りおろしソースが美味しい生姜焼きは、菜の花のごま豆腐かけと共に,,2016-03-07,2,1,2014-04-10 00:00:00,1,2016-11-11 00:00:00,,,,,,,
635,1,635,イカのたれ漬け焼きといんげんのそぼろ炒め献立,たれに漬けたイカをレンジで加熱している間に、いんげんと鶏ミンチをささっと炒めて！,,2016-03-08,2,1,2014-04-10 00:00:00,1,2016-11-11 00:00:00,,,,,,,
636,1,636,ナスの肉巻き献立,ナスを豚肉で巻いてstillたれと合えて焼くだけ。えのきの梅肉和えはレンジで簡単！,,2016-03-10,2,1,2014-04-10 00:00:00,1,2016-11-11 00:00:00,,,,,,,
637,1,637,鮭の味噌マヨグリル献立,味噌と茹で玉子とマヨを混ぜて、鮭に乗せてグリルで焼くだけ！コーン入り玉子焼きをご一緒に,,2016-03-11,2,1,2014-04-10 00:00:00,1,2016-11-11 00:00:00,,,,,,,
638,1,638,スパイシー春巻きとビーフン献立,スパイシー春巻きはカレー粉がアクセント！ビーフンと共に、気分はアジアン！,,2016-03-12,2,1,2014-04-10 00:00:00,1,2016-11-11 00:00:00,,,,,,,
649,1,649,鶏ささみのチーズロール献立,鶏ささみともっちりとしたチーズは相性抜群！ほうれん草と人参とちくわの炒めと共に。,,2016-03-14,2,1,2014-04-10 00:00:00,1,2016-11-11 00:00:00,,,,,,,
650,1,650,stillたれで焼肉献立,牛肉をにんにく、生姜、玉ねぎすりおろしとstillたれに漬け込んでおいて焼くだけ。その間に、サラダとお味噌汁を作ります。,,2016-03-15,2,1,2014-04-10 00:00:00,1,2016-11-11 00:00:00,,,,,,,
651,1,651,とろみあんが美味しい筍とハムの天津飯献立,天津飯は筍とハムと卵を混ぜてとろみあんをかけるだけ、簡単なのに美味しい！,,2016-03-16,2,1,2014-04-10 00:00:00,1,2016-11-11 00:00:00,,,,,,,
652,1,652,麻婆豆腐と大根帆立のサラダ献立,豚ミンチにしっかり下味をつけて、簡単なのに本格化麻婆豆腐です。大根と帆立のサラダと共に,,2016-03-17,2,1,2014-04-10 00:00:00,1,2016-11-11 00:00:00,,,,,,,
653,1,653,鮭の味噌マヨグリル献立,茹で玉子と味噌、砂糖、マヨネーズを混ぜ合わせ味噌マヨを作り生鮭に乗せて焼くだけ。キャベツの甘辛酢和えと共に,,2016-03-18,2,1,2014-04-10 00:00:00,1,2016-11-11 00:00:00,,,,,,,
654,1,654,じゃがいもオムレツトのマトソースかけとコールスローサラダ献立,酸味のきいたトマトソースが美味しいじゃがいものオムレツは、コールスローサラダと合わせてさっぱりと,,2016-03-19,2,1,2014-04-10 00:00:00,1,2016-11-11 00:00:00,,,,,,,
655,1,655,鰺のピカタと大根とツナのきんぴら献立,お魚が苦手なお子様もピカタにすると食べやすいですよ。大根とツナのきんぴらと一緒に！,,2016-05-01,2,1,2014-04-10 00:00:00,1,2016-11-11 00:00:00,,,,,,,
656,1,656,擦りおろしりんごが美味しいチキンカレー献立,玉ねぎとりんごを擦りおろして作るチキンカレーは、簡単なのに本格化！あとはルーで煮こむだけ！,,2016-03-22,2,1,2014-04-10 00:00:00,1,2016-11-11 00:00:00,,,,,,,
658,1,658,あなごの梅しそ巻き献立,あなごに、梅しそを挟んでくるくる巻いて揚げるだけ！簡単で美味しい！,,2016-03-24,2,1,2014-04-10 00:00:00,1,2016-11-11 00:00:00,,,,,,,
659,1,659,肉コロうどんと三色野菜の卵炒め献立,豚肉をstillたれと生姜で絡めて炒り煮して、うどんに乗せるだけ！人参、ほうれん草、もやしの卵炒めと共に,,2016-03-25,2,1,2014-04-10 00:00:00,1,2016-11-11 00:00:00,,,,,,,
703,1,703,簡単手間無し！鶏の味噌漬け焼き献立,前日から味噌漬けにしておいた鶏をグリルで焼いている間に、スープとサラダを作ります。簡単手間無し！,,2016-04-07,2,1,2014-04-10 00:00:00,1,2016-11-11 00:00:00,,,,,,,
720,1,720,鶏肉の黒酢炒め献立,鶏肉はstillたれと黒酢に漬けこんでおきます。しっかり味が浸みこんだ鶏肉と野菜が絡みあってとっても美味しい！,,2016-05-09,2,1,2014-04-10 00:00:00,1,2016-11-11 00:00:00,,,,,,,
741,1,741,ポン酢でさっぱりと鯖のきのこおろし献立,焼き鯖にしめじを乗せてポン酢でさっぱりと。ピーマン昆布は、レンジ調理だから簡単,,2016-03-28,2,1,2014-04-10 00:00:00,1,2016-11-11 00:00:00,,,,,,,
742,1,742,えのきの梅肉和えと豚じゃぶうどん献立,えのきの梅肉和えをレンジ調理している間に出汁を温めて豚じゃぶうどんを作ります。簡単で美味しい献立です,,2016-04-01,2,1,2014-04-10 00:00:00,1,2016-11-11 00:00:00,,,,,,,
743,1,743,牛肉と筍の炒め物献立,野菜もたっぷりとれて美味しい牛肉と筍の炒め物。レンジで作るとふろふき大根とともに,,2016-04-04,2,1,2014-04-10 00:00:00,1,2016-11-11 00:00:00,,,,,,,
744,1,744,旬のあさりが美味しい！海鮮スープと旬菊のサラダ,旬のアサリが美味しい！海鮮スープは、春菊のサラダと合わせて,,2016-04-05,2,1,2014-04-10 00:00:00,1,2016-11-11 00:00:00,,,,,,,
745,1,745,今が旬！春キャベツのベーコン炒めとタラとじゃがいものグラタン,タラとじゃがいもはクリーミーなホワイトソースと良く合う！春キャベツはベーコンと炒めて、旬野菜を味わいます,,2016-04-06,2,1,2014-04-10 00:00:00,1,2016-11-11 00:00:00,,,,,,,
746,1,746,レンジで作るふろふき大根と鰯の梅煮,鍋に鰯を入れて煮ている間に、レンジでふろふき大根をささっと作ります,,2016-04-08,2,1,2014-04-10 00:00:00,1,2016-11-11 00:00:00,,,,,,,
859,1,859,今が旬！筍とブロッコリーのパスタ献立,筍とstillだしたれを絡めて作る簡単パスタです。ほうれん草の卵巻きと共に,,2016-04-13,2,1,2014-04-10 00:00:00,1,2016-11-11 00:00:00,,,,,,,
860,1,860,ブリのカレー風味照り焼きと新じゃが中華サラダ,ふっくらとしたブリにカレー粉、stillたれを絡めて焼くだけ。新じゃがで作る中華サラダも美味しい。,,2016-04-09,2,1,2014-04-10 00:00:00,1,2016-11-11 00:00:00,,,,,,,
861,1,861,フライパン１つで作る簡単シーフードパエリア献立,フライパンに具材と米を混ぜ合わせて煮こむだけで簡単に作れるパエリアです,,2016-04-10,2,1,2014-04-10 00:00:00,1,2016-11-11 00:00:00,,,,,,,
862,1,862,じゃがいもと豚バラのザーサイ炒め献立,豚バラとザーサイ、じゃがいもの組合せば抜群！いり胡麻をかけたら風味アップ！大根とホタテのサラダと共に,,2016-04-11,2,1,2014-04-10 00:00:00,1,2016-11-11 00:00:00,,,,,,,
863,1,863,お弁当にも最適！牛丼献立,牛肉をだしとstillたれで絡めるだけ。白ご飯と良く合います。人参とツナのサラダと共に,,2016-04-12,2,1,2014-04-10 00:00:00,1,2016-11-11 00:00:00,,,,,,,
864,1,864,照り焼きアボカド丼と青菜炒め献立,アボカドとジューシーな鶏との相性は抜群。白ご飯と共に頂きます,,2016-04-14,2,1,2014-04-10 00:00:00,1,2016-11-11 00:00:00,,,,,,,
866,1,866,レンジで作る簡単アマトリチャーナ献立,パスタの具材を耐熱容器に入れレンジで加熱するだけ！簡単で美味しいアマトリチャーナ。レンジ加熱の間に、サラダを手早く作ります,,2016-04-20,2,1,2014-04-10 00:00:00,1,2016-11-11 00:00:00,,,,,,,
868,1,868,千切りキャベツとハムの春巻き揚げ献立,しゃきしゃきの千切りキャベツを春巻きで巻いてカリッと揚げるだけ。,,2016-04-17,2,1,2014-04-10 00:00:00,1,2016-11-11 00:00:00,,,,,,,
869,1,869,鯖のつけ焼きとアボカド味噌グラタン献立,鯖の漬け焼きをグリルで焼いている間に、アボカドの上に豆腐と味噌を混ぜ合わせた具材をのせてオーブンで焼くだけ,,2016-04-18,2,1,2014-04-10 00:00:00,1,2016-11-11 00:00:00,,,,,,,
871,1,871,じゃこと梅の混ぜご飯と鰺フライ献立,カリッと揚げた鰺のフライとさっぱりしたじゃこ梅ご飯がよく合います。もずくスープと共に,,2016-04-19,2,1,2014-04-10 00:00:00,1,2016-11-11 00:00:00,,,,,,,
