one_menu_meal_id,one_menu_course_id,one_menu_id,title,main_theme,sub_theme,release_date,release_status,created_id,created_at,updated_id,updated_at,admin_note,shoppinglist_remarks,precooking_remarks,cooking_remarks,one_day_schedule_algorithm,pre_cooking_schedule_algorithm,cooking_schedule_algorithm
10995,1,24367,きのこのオイスターソース煮献立,お豆腐の入った、きのこのオイスターソース煮です。とろみをつけていただきます,"",2017-10-19,2,11,2017-09-27 16:54:45,11,2017-10-06 09:16:33,"","","","",,,
10996,1,24122,カレイのから揚げ献立,カラリと揚げたカレイをポン酢でいただきます。二度揚げするのがポイントです,"",2017-10-20,2,11,2017-09-27 16:56:08,11,2017-10-06 09:16:45,"","","","",,,
10997,1,24139,究極の黒豚で根菜バーグきのこあんかけ献立,秋がギュッと詰まった根菜バーグきのこあんかけはいかがですか♪,"",2017-10-21,2,11,2017-09-27 16:57:09,11,2017-10-06 09:16:55,"","","","",,,
10998,1,24033,油琳鶏献立,カラリと二度揚げした鶏肉に甘酸っぱいタレをかけていただきます。ボリュームのある一品です,"",2017-10-22,2,11,2017-09-27 16:59:39,11,2017-10-06 09:17:06,"","","","",,,
10999,1,15684,天津飯献立,筍の食感が良いアクセントの天津飯です。蒸し鶏に中華風のタレを添えて,"",2017-10-23,2,11,2017-09-27 17:00:39,11,2017-10-06 09:17:18,"","","","",,,
11000,1,24366,しし唐の豚肉巻き献立,豚ばら肉をしし唐にクルクル巻いています。Stillたれの味付けでご飯がとってもすすみますよ,"",2017-10-24,2,11,2017-09-27 17:01:43,11,2017-10-06 09:17:32,"","","","",,,
11001,1,24340,イクラとスモークサーモンのクリームパスタ献立,パスタが熱いうちに盛り付けたイクラとスモークサーモンは、トロッとした口ざわり。レモンの風味がさわやかなクリームソースです,"",2017-10-25,2,11,2017-09-27 17:02:53,11,2017-10-06 09:17:44,"","","","",,,
11002,1,19663,台湾風鶏の卵つけ焼き献立,下味をつけた鶏肉を卵にくぐらせてから焼きます。しっかりこしょうを利かせるのがオススメ,"",2017-10-26,2,11,2017-09-27 17:04:03,11,2017-10-06 09:17:54,"","","","",,,
11003,1,24655,牛サーロインのタリアータ・サラダ仕立て献立,週末に奮発してお肉を焼いてみませんか。おかずサラダレシピです♪アボカドと小海老のディップを添えて,"",2017-10-27,2,11,2017-10-12 16:30:29,11,2017-10-24 09:39:59,"","","","",,,
11004,1,24656,甘辛鶏のから揚げ献立,いつもの鶏のから揚げではなく鶏肉を揚げてから甘辛いタレを絡めています,"",2017-10-28,2,11,2017-10-12 16:31:33,11,2017-10-24 09:40:10,"","","","",,,
11005,1,24678,豚肉ときのこのオイスター炒め献立,ぶなしめじや舞茸を入れた秋にピッタリなオイスター炒めです。中華風のスープとご一緒にどうぞ,"",2017-10-29,2,11,2017-10-12 16:32:41,11,2017-10-24 09:40:27,"","","","",,,
11006,1,21004,鶏照りアボカド丼献立,stillたれで香ばしく焼いた甘辛い鶏肉がアボカドとよく合います！薬味をきかせた冷奴とご一緒にどうぞ,"",2017-10-30,2,11,2017-10-12 16:33:33,11,2017-10-24 09:40:39,"","","","",,,
11007,1,24657,鮭とほうれん草のオムレツ献立,ふっくらオムレツに鮭やほうれん草がたっぷり。ヘルシーなのに食べごたえがあります。お弁当にもお勧めです！,"",2017-11-01,2,11,2017-10-12 16:34:31,11,2017-10-24 09:40:51,"","","","",,,
11008,1,24658,えのきバーグ献立,えのきをタネに混ぜ込んで焼きます。汁物もきのこで♪副菜も食物繊維たっぷりです,"",2017-11-02,2,11,2017-10-12 16:35:48,11,2017-10-24 09:41:01,"","","","",,,
11009,1,24676,鶏のゆずこしょう焼き献立,柚子こしょうの香りが爽やかな一品です。お酒にも合いそうですね,"",2017-11-03,2,11,2017-10-12 16:36:42,11,2017-10-24 09:41:11,"","","","",,,
11010,1,24680,白身魚の地中海風献立,にんにくの香りが食欲をそそります。ワインが合いそうな一品です,"",2017-11-04,2,11,2017-10-12 16:37:36,11,2017-10-24 09:41:23,"","","","",,,
11011,1,23105,手作りニラ餃子献立,休日に餃子を手作りしてみませんか。さっとできる中華風サラダとご一緒に,"",2017-11-05,2,11,2017-10-12 16:39:11,11,2017-10-24 09:41:36,"","","","",,,
11012,1,24687,鶏と野菜の甘酢からめ献立,鶏肉と野菜が甘酢と絡まり、ご飯がすすむ一品です。栄養バランスも良くお弁当のおかずとしてもおすすめですよ,"",2017-11-06,2,11,2017-10-12 16:40:25,11,2017-10-24 09:41:47,"","","","",,,
11013,1,24116,坦坦麺(うどん)献立,今日は立冬ですね。冬の気配が感じられる日には温かいうどんで温まりましょう,"",2017-11-07,2,11,2017-10-12 16:41:24,11,2017-10-24 09:41:57,"","","","",,,
11014,1,24659,うなぎの散らし寿司献立,疲労回復、ビタミン豊富で目にも良いとされている鰻。鰻の脂がのるのは冬だそうですね,"",2017-11-08,2,11,2017-10-12 16:46:32,11,2017-10-24 09:42:10,"","","","",,,
11015,1,24681,大根と豚ばらの煮物献立,大根の消化酵素が胃腸を整えてくれます。豚肉と大根を出汁や醤油などの調味料で煮込んだ煮物料理です,"",2017-11-09,2,11,2017-10-12 16:47:21,11,2017-10-24 09:42:19,"","","","",,,
11016,1,21408,かぼちゃのピザ献立,ハロウィンに春巻きの皮でかぼちゃのピザを作ります。さっぱりとコールスローサラダとご一緒にどうぞ,"",2017-10-31,2,11,2017-10-13 10:15:09,11,2017-10-24 09:42:28,"","","","",,,
11017,1,24726,親子丼献立,stillたれで作る親子丼です。とろとろの卵がたまらない定番の丼です。野菜のお味噌汁とご一緒に,"",2017-11-10,2,11,2017-10-26 15:52:20,11,2017-11-07 09:13:51,"","","","",,,
11018,1,25086,イカとニラのチヂミ献立,コチュジャンを少し効かせたピリ辛ダレはお酒にも合いますね,"",2017-11-11,2,11,2017-10-26 15:53:38,11,2017-11-07 09:13:39,"","","","",,,
11019,1,24683,麻婆ナス献立,ご飯のお供にピッタリの麻婆ナスです。中華味のスープとご一緒にどうぞ,"",2017-11-12,2,11,2017-10-26 15:54:50,11,2017-11-07 09:14:01,"","","","",,,
11020,1,12527,和風レンコンバーグ献立,鶏もも挽き肉で作るヘルシーハンバーグです。副菜の野菜もモリモリいただきましょう,"",2017-11-13,2,11,2017-10-26 15:56:36,11,2017-11-07 09:14:11,"","","","",,,
11021,1,25088,豚肉の肉団子カレー塩献立,カレー塩で食べる肉団子です。きのこたっぷりのスープもご一緒に,"",2017-11-14,2,11,2017-10-26 15:58:10,11,2017-11-07 09:14:29,"","","","",,,
11022,1,25089,鮭の混ぜ寿司献立,鮭のみのシンプルな混ぜ寿司です。彩りの綺麗な副菜とご一緒にどうぞ,"",2017-11-15,2,11,2017-10-26 15:59:34,11,2017-11-07 09:27:16,"","","","",,,
11023,1,13665,白身魚のとろーりモッツァレラチーズ鍋献立,ボジョレ・ヌヴォー解禁日！酸味のあるトマトソースにチーズが絡み合います,"",2017-11-16,2,11,2017-10-26 16:01:06,11,2017-11-07 09:27:30,"","","","",,,
11024,1,25090,舞茸と豚の味わいたっぷり丼献立,みりんとしょう油で甘く煮詰めた舞茸と豚肉は、白ご飯に良く合います,"",2017-11-17,2,11,2017-10-26 16:02:28,11,2017-11-07 09:27:42,"","","","",,,
11025,1,18090,牛肉とピーマンの細切り炒め献立,ピーマンと筍のシャキシャキ食感を楽しみましょう。ピリ辛の副菜を合わせました,"",2017-11-18,2,11,2017-10-26 16:04:04,11,2017-11-07 09:27:57,"","","","",,,
11026,1,25091,さつまいもの吹き寄せ甘酢あん献立,秋の味覚が楽しい一皿です。さつまいもやレンコンはじっくり揚げて、きのこやいんげんはサッと揚げるのがコツ。色んな食感が楽しめます,"",2017-11-19,2,11,2017-10-26 16:05:17,11,2017-11-07 09:28:11,"","","","",,,
11027,1,25092,きのこのパスタ献立,きのこたっぷりのシンプルなパスタです。さっぱりとヨーグルトサラダを添えて,"",2017-11-20,2,11,2017-10-26 16:06:28,11,2017-11-07 09:28:21,"","","","",,,
11028,1,25093,千切り野菜で食べる鯖の唐揚げ献立,セロリの風味が爽やかな一品です。ボリュームもたっぷり♪,"",2017-11-21,2,11,2017-10-26 16:08:06,11,2017-11-07 09:28:31,"","","","",,,
11029,1,25094,鶏と栗の炒め煮献立,鶏肉を合わせて、stillたれで甘辛く。栗もほっこりして美味しいです,"",2017-11-22,2,11,2017-10-26 16:09:23,11,2017-11-07 09:28:39,"","","","",,,
11030,1,25095,みぞれ豚しゃぶ鍋献立,大根おろしのみぞれ鍋。ビタミン、食物繊維も豊富！鍋の後は雑炊にしても美味しいです,"",2017-11-23,2,11,2017-10-26 16:10:49,11,2017-11-07 09:28:49,"","","","",,,
11031,1,25510,鶏の照り焼きと焼き野菜献立,焼き野菜を添えて彩りも鮮やかに。大根のお味噌汁で温まりましょう,"",2017-11-24,2,11,2017-11-10 10:55:22,11,2017-11-17 09:08:34,"","","","",,,
11032,1,14545,ほうれん草と牡蠣のグラタン献立,牡蠣とホワイトソースは相性バッチリ！ホワイトソースも電子レンジで簡単に手作りできます♪,"",2017-11-25,2,11,2017-11-10 10:58:17,11,2017-11-17 09:08:56,"","","","",,,
11033,1,25512,とうもろこしの焼きしゅうまい献立,とうもろこしのプリプリ食感が味わえる「とうもろこしの焼きしゅうまい」！お弁当のおかずに最適ですよ,"",2017-11-26,2,11,2017-11-10 10:59:34,11,2017-11-17 09:09:09,"","","","",,,
11034,1,25511,鶏むね肉のパプリカビネガー風献立,むね肉は加熱してからマリネすることでさっぱりとジューシーに仕上がります,"",2017-11-27,2,11,2017-11-10 11:00:51,11,2017-11-17 09:09:25,"","","","",,,
11035,1,17126,スモークサーモンとほうれん草のフィットチーネ献立,スモークサーモンの塩気が効いた、彩りも綺麗なパスタ料理です,"",2017-11-28,2,11,2017-11-10 11:02:53,11,2017-11-17 09:09:37,"","","","",,,
11036,1,25513,白菜とひき肉の中華炒め献立,合わせ調味料でササッと出来上がる炒め物です。豆板醤でピリ辛に！,"",2017-11-29,2,11,2017-11-10 11:03:55,11,2017-11-17 09:09:49,"","","","",,,
11037,1,25514,野菜たっぷり塩焼きそば献立,塩味の野菜をたっぷり使ったやきそばです。温かいスープとご一緒に,"",2017-11-30,2,11,2017-11-10 11:05:18,11,2017-11-17 09:10:09,"","","","",,,
11038,1,25515,椎茸の肉詰め献立,椎茸の肉詰めは生姜醤油でさっぱりと。じゃがいも明太はレンジでお手軽です,"",2017-12-01,2,11,2017-11-10 11:06:28,11,2017-11-17 09:10:21,"","","","",,,
11039,1,25521,牡蠣とエリンギのガーリックバター献立,ふんわりと、そしてプリプリした牡蠣とエリンギの歯ごたえが楽しい一品です♪,"",2017-12-02,2,11,2017-11-10 11:07:21,11,2017-11-17 09:10:33,"","","","",,,
11040,1,25517,ごろごろトマトのソースカツ献立,サクサクに揚げたトンカツにミニトマトのソースをかけていただきます。食べ応えがありますよ,"",2017-12-03,2,11,2017-11-10 11:08:26,11,2017-11-17 09:10:44,"","","","",,,
11041,1,25518,トマトとちりめんじゃこのオムレツ献立,ちりめんじゃことチーズの入ったオムレツです。カルシウムをたっぷり摂れてオススメです,"",2017-12-04,2,11,2017-11-10 11:10:18,11,2017-11-17 09:10:54,"","","","",,,
11042,1,25523,きのこ＆鶏肉のクリーム煮献立,きのこ＆鶏肉のクリーム煮で温まりませんか。食べ応えのあるサラダとご一緒に,"",2017-12-05,2,11,2017-11-10 11:11:12,11,2017-11-17 09:11:07,"","","","",,,
11043,1,10096,マグロとアボカド寿司献立,弾力のあるマグロとまったりとしたアボカドのマリアージュは抜群に美味しい！,"",2017-12-06,2,11,2017-11-10 11:12:05,11,2017-11-17 09:11:17,"","","","",,,
11044,1,25520,簡単ポークピカタ献立,生姜焼き用のお肉を使って手軽にポークピカタが作れちゃいます！お弁当にもおススメ♪,"",2017-12-07,2,11,2017-11-10 11:13:13,11,2017-11-17 09:11:26,"","","","",,,
11045,1,11703,かぶとエビのクリーム煮献立,満足感もあり、体がほっこりあたたまる一品です。かぶの葉の食感もお楽しみください,"",2017-12-08,2,11,2017-11-22 15:55:39,11,2017-12-05 10:01:35,"","","","",,,
11046,1,25860,鶏のから揚げ献立,みんなが大好きな鶏のから揚げです。副菜と汁物で野菜をとりましょう,"",2017-12-09,2,11,2017-11-22 16:00:05,11,2017-12-05 10:01:58,"","","","",,,
11047,1,25863,牡蠣のスモークサーモン巻ソテー献立,そのままでも美味しいスモークサーモンですが、濃厚でクリーミーな味わいの牡蠣とのマリアージュ♪,"",2017-12-10,2,11,2017-11-22 16:03:13,11,2017-12-05 10:02:12,"","","","",,,
11048,1,25864,鶏ごぼうめし献立,炊きたてのごはんに鶏ごぼうめしの具を混ぜ合わせて♪かぼちゃのお味噌汁で温まりましょう,"",2017-12-11,2,11,2017-11-22 16:14:10,11,2017-12-05 10:02:23,"","","","",,,
11049,1,25866,ナスの肉巻き献立,ナスをお肉で巻いているので、食べ応えバツグン！食卓、お弁当、おつまみと…さまざまなシチュエーションで♪,"",2017-12-12,2,11,2017-11-22 16:26:06,11,2017-12-05 10:02:40,"","","","",,,
11050,1,25869,タラとたっぷり野菜のレンジ蒸し献立,たっぷりの野菜と一緒に電子レンジでチンするだけの簡単おかずです。生姜とお酢が効いたタレで、たっぷり野菜もモリモリ食べられます,"",2017-12-13,2,11,2017-11-22 16:33:44,11,2017-12-05 10:02:52,"","","","",,,
11051,1,25870,鶏むね肉の竜田揚げ梅ソース献立,梅のソースでさっぱりいただける竜田揚げです。お酒のお供にもいかがですか,"",2017-12-14,2,11,2017-11-22 16:40:15,11,2017-12-05 10:03:06,"","","","",,,
11052,1,10726,豚肉のキムチ炒め献立,合わせ調味料でササッと出来上がる炒め物です。きのこの中華スープとご一緒にどうぞ,"",2017-12-15,2,11,2017-11-22 16:45:43,11,2017-12-05 10:03:18,"","","","",,,
11053,1,25872,ちゃんこ鍋献立,温かいお鍋で温まりましょう♪生姜を効かせた鶏つくねを手作りしませんか,"",2017-12-16,2,11,2017-11-22 16:47:10,11,2017-12-05 10:03:31,"","","","",,,
11054,1,26015,エビ蒸し餃子献立,休日に餃子を手作りしてみませんか。さっとできる即席漬けとご一緒に,"",2017-12-17,2,11,2017-11-22 16:59:11,11,2017-12-05 10:03:45,"","","","",,,
11055,1,26012,チキンと白菜のクリーム煮献立,鶏むね肉を使ったクリーム煮です。味噌を隠し味として入れるとコクが出て美味しいですよ,"",2017-12-18,2,11,2017-11-27 09:18:21,11,2017-12-05 10:03:56,"","","","",,,
11056,1,26010,牛肉と野菜のおかずマリネ献立,白いご飯にもお酒の肴にもピッタリの一品。すぐできて美味しいあっさり漬けとご一緒にどうぞ,"",2017-12-19,2,11,2017-11-27 09:20:39,11,2017-12-05 10:04:07,"","","","",,,
11057,1,26011,鮭と白菜のとろ～りあんかけ蒸し献立,寒い時期に、ホッと温まるやさしい料理です。レンジでできる副菜とご一緒に,"",2017-12-20,2,11,2017-11-27 09:23:04,11,2017-12-05 10:04:19,"","","","",,,
11058,1,26017,鶏の照り焼き献立,調味料は「stillたれ」だけの簡単作り置き！お弁当のメインおかずにもピッタリですよ♪,"",2017-12-21,2,11,2017-11-27 09:24:52,11,2017-12-05 10:05:02,"","","","",,,
11059,1,26263,パンプキングラタン献立,今日は1年で最も日が短い「冬至」ですね。風邪予防のためにもかぼちゃを食べましょう！,"",2017-12-22,2,11,2017-12-05 14:48:58,11,2017-12-19 13:51:05,"","","","",,,
11060,1,26264,エビのマヨネーズソース献立,プリプリなエビの食感をお楽しみください。食べ応えのあるサラダを添えて,"",2017-12-23,2,11,2017-12-05 14:51:21,11,2017-12-19 13:51:21,"","","","",,,
11061,1,26265,ホットプレートでお手軽ビビンバ献立,ホットプレートで作るビビンバは皆でワイワイと楽しめ、手軽でしかも石焼き風の仕上がりに,"",2017-12-24,2,11,2017-12-05 14:53:12,11,2017-12-19 13:51:36,"","","","",,,
11062,1,26481,油琳鶏献立,カラリと二度揚げした鶏肉に甘酸っぱいタレをかけていただきます。ボリュームのある一品です,"",2017-12-25,2,11,2017-12-05 14:56:05,11,2017-12-19 13:51:45,"","","","",,,
11063,1,24042,ほうれん草とベーコンのパスタ献立,ほうれん草とベーコンの定番パスタです。冷蔵庫にストックしておくと便利なかぼちゃのスープとご一緒に,"",2017-12-26,2,11,2017-12-05 14:57:10,11,2017-12-19 13:51:54,"","","","",,,
11064,1,14316,じゃがいもと鮭の北海煮献立,肉じゃがならぬ「さけじゃが」仕上げのバターで風味をつけます。ごま油でカリカリに炒めた、じゃこの風味の春菊のサラダをご一緒に,"",2017-12-27,2,11,2017-12-05 14:58:23,11,2017-12-19 13:52:02,"","","","",,,
11065,1,26266,牛肉と舞茸のスタミナ炒め献立,舞茸はお肉を軟らかくします。お肉でスタミナを付けて年末を乗り切りましょう,"",2017-12-28,2,11,2017-12-05 14:59:35,11,2017-12-19 13:52:12,"","","","",,,
11066,1,26279,タラのチゲ鍋献立,タラの旨味を寒い日にピッタリなチゲ鍋で。お子様と一緒に食べるときは、みそとコチュジャンの量を変えて辛みを調節しましょう,"",2017-12-29,2,11,2017-12-05 15:00:36,11,2017-12-19 13:52:21,"","","","",,,
11067,1,17320,チキンカレー献立,正月料理に飽きたらカレーはいかがですか？タルタル風ソースのサラダとご一緒に,"",2018-01-04,2,11,2017-12-19 11:17:38,11,2017-12-19 13:53:25,"","","","",,,
11068,1,23225,ニラと豆腐の帆立あん仕立て,旨味たっぷりのホタテの水煮缶を汁ごと使いました。ホッとする優しい味のあんかけです,"",2018-01-05,2,11,2017-12-21 09:22:17,11,2017-12-22 13:52:13,"","","","",,,
11069,1,26267,里芋の中華風煮込み献立,里芋のネバネバパワー！にんにくと生姜の風味がきいた里芋のピリ辛炒め煮でいただきましょう,"",2018-01-06,2,11,2017-12-21 09:23:17,11,2017-12-22 13:52:25,"","","","",,,
11070,1,26679,鶏もも肉の甘味噌焼き献立,冷蔵庫にお正月の白味噌は残っていませんか？お弁当のおかずにもピッタリですよ♪,"",2018-01-07,2,11,2017-12-21 09:24:33,11,2017-12-22 13:52:36,"","","","",,,
11071,1,26665,金目鯛とごぼうの含め煮献立,成人式を迎えられる方々へのおめでたいレシピです。電子レンジで作るふろふき大根とご一緒に,"",2018-01-08,2,11,2017-12-21 09:25:28,11,2017-12-22 13:52:46,"","","","",,,
11072,1,26681,もやしと豚バラ肉のピリ辛中華炒め献立,たっぷりのもやしに豚バラ肉を合わせた、ボリュームたっぷりでパンチのあるおかずです,"",2018-01-09,2,11,2017-12-21 09:26:25,11,2017-12-22 13:52:57,"","","","",,,
11073,1,19016,鶏ささみの梅肉巻き献立,レンジで手軽にできるオススメのレシピです。ささみと梅干しの相性もバツグンです,"",2018-01-10,2,11,2017-12-21 09:27:31,11,2017-12-22 13:53:10,"","","","",,,
11074,1,26667,お餅グラタン献立,鏡開きのお餅を使ってグラタンはいかがですか？2つの材料でできる副菜とご一緒に♪,"",2018-01-11,2,11,2017-12-21 09:31:43,11,2017-12-22 13:53:19,"","","","",,,
11075,1,18370,豚肉の黒こしょう焼き献立,豚肉はしっかり焼き付けることで食欲をそそります。ヘルシーな大根とツナのきんぴらとご一緒に,"",2018-01-12,2,11,2017-12-21 09:32:42,11,2017-12-22 13:53:28,"","","","",,,
11076,1,26682,タラと野菜のトマト鍋献立,トマトの洋風鍋です。シメにトマトチーズリゾットはいかがですか♪,"",2018-01-13,2,11,2017-12-21 09:33:41,11,2017-12-22 13:53:39,"","","","",,,
11077,1,26683,チキンナゲット献立,ご家庭でチキンナゲットを作ってみませんか。食べ応えのあるマリネを添えて,"",2018-01-14,2,11,2017-12-21 09:34:53,11,2017-12-22 13:53:48,"","","","",,,
11078,1,26669,ハンバーグのトマトソース煮献立,お子様も大好きなハンバーグレシピ♪リコピンも多く含み女性にも喜ばれますね,"",2018-01-15,2,11,2017-12-21 09:36:23,11,2017-12-22 13:53:57,"","","","",,,
11079,1,23785,カイワレと牛肉のささっと炒め献立,カイワレとマスタードの風味でさっぱりいただけます。副菜はカロチンたっぷりです,"",2018-01-16,2,11,2017-12-21 09:40:25,11,2017-12-22 13:54:07,"","","","",,,
11147,1,29355,ブロッコリーと白身魚の黄金焼き献立,ブロッコリーと白身魚の黄金焼きをピーラーサラダと一緒にどうぞ！,"",2018-03-25,2,15,2018-03-12 13:11:13,15,2018-03-14 15:16:39,"","","","",,,
11080,1,26670,長芋のシーフードグラタン献立,長芋は歯ごたえを愉しむために角切りにし、だしとしょう油で和風に仕上げました,"",2018-01-17,2,11,2017-12-21 09:42:38,11,2017-12-22 13:54:16,"","","","",,,
11081,1,26671,鶏照りアボカド丼献立,stillたれで香ばしく焼いた甘辛い鶏肉がアボカドとよく合います！お味噌汁とご一緒に,"",2018-01-18,2,11,2017-12-21 09:43:21,11,2017-12-22 13:54:25,"","","","",,,
11082,1,26672,豚肉とアスパラ炒め献立,胡麻油の香りが食欲をそそる一品です。サッパリいただけますよ,"",2018-01-19,2,11,2017-12-21 09:46:10,11,2017-12-22 13:54:35,"","","","",,,
11083,1,26806,甘辛鶏のから揚げ献立,いつもの鶏のから揚げではなく鶏肉を揚げてから甘辛いタレを絡めています,"",2018-01-20,2,11,2017-12-25 09:40:47,5,2018-01-16 13:31:15,"","","","",,,
11084,1,26810,回鍋肉献立,甘辛い味付けで間違いなくご飯に合う一品です。中華風のスープとご一緒に,"",2018-01-21,2,11,2017-12-25 09:41:31,5,2018-01-16 13:31:34,"","","","",,,
11085,1,26811,大根と手羽中の煮物献立,実山椒が入っているので、ちょっぴり大人の味に仕上がっています。一晩おくと更に美味しい♪,"",2018-01-22,2,11,2017-12-25 09:42:31,5,2018-01-16 13:31:51,"","","","",,,
11086,1,26798,鮭のから揚げサラダ献立,さっくり揚げ焼きにした鮭がピリ辛の甘酸っぱいドレッシングとよく合います,"",2018-01-23,2,11,2017-12-25 09:43:55,5,2018-01-16 13:32:05,"","","","",,,
11087,1,17338,ちくわの天とじ丼献立,ちくわを使ったカンタン丼。野菜たっぷりの味噌汁とご一緒に,"",2018-01-24,2,11,2017-12-25 09:45:17,5,2018-01-16 13:30:55,"","","","",,,
11088,1,26812,麻婆大根献立,ほろりとトロける大根が美味しい一品です♪さっぱりした副菜とごいっしょに,"",2018-01-25,2,11,2017-12-25 09:46:52,5,2018-01-16 13:30:37,"","","","",,,
11089,1,26818,エスニック風串焼き献立,柚子こしょうの香りが爽やかな一品です。お酒のお供にもいかがですか,"",2018-01-26,2,11,2017-12-25 09:48:22,5,2018-01-16 13:30:22,"","","","",,,
11090,1,26805,生姜たれで食べる肉と野菜献立,これなら忙しい日のスピード晩御飯にぴったりですよ♪,"",2018-01-27,2,11,2017-12-25 09:49:34,5,2018-01-16 13:30:05,"","","","",,,
11091,1,5650,かぼちゃのピザ献立,春巻きの皮でかぼちゃのピザを作ります。セロリとささみのサラダとご一緒にどうぞ,"",2018-01-28,2,11,2017-12-25 09:51:08,5,2018-01-16 13:29:50,"","","","",,,
11092,1,26819,ポークピカタ献立,チーズをサンドしたポークピカタです。バジル風味のサラダとご一緒に,"",2018-01-29,2,11,2017-12-25 09:55:31,5,2018-01-16 13:29:35,"","","","",,,
11093,1,26794,鯖の甘酢から揚げ献立,揚げた鯖を甘酢に漬け込んだお弁当にも使えるレシピです。副菜で野菜を補います,"",2018-01-30,2,11,2017-12-25 09:56:49,5,2018-01-16 13:29:23,"","","","",,,
11094,1,26801,お餅とツナの肉巻き献立,お正月のお餅が残っていれば・・・海苔を大葉にしたり、ツナをチーズにしたりとお好みの味でどうぞ♪,"",2018-01-31,2,11,2017-12-25 09:58:12,5,2018-01-16 13:29:01,"","","","",,,
11095,1,26817,天津飯献立,筍の食感が良いアクセントの天津飯です。ピリ辛きゅうりを添えて,"",2018-02-01,2,11,2017-12-25 09:59:21,5,2018-01-16 13:28:45,"","","","",,,
11096,1,26804,サーモンのハーブグリル献立,ローズマリーの香りが爽やかな一品です。さっぱり春雨サラダもご一緒に,"",2018-02-02,2,11,2017-12-25 10:01:17,5,2018-01-16 13:28:22,"","","","",,,
11097,1,27617,手作りニラ餃子献立,休日に餃子を手作りしてみませんか。青梗菜と椎茸のスープとご一緒に,"",2018-02-03,2,15,2018-01-23 16:52:47,15,2018-01-26 18:54:12,"","","","",,,
11098,1,27616,きのこのパスタ献立,きのこたっぷりのシンプルなパスタです。トマトスープと一緒にどうぞ,"",2018-02-04,2,15,2018-01-23 16:55:08,15,2018-01-26 18:54:06,"","","","",,,
