one_menu_meal_id,one_menu_course_id,one_menu_id,title,main_theme,sub_theme,release_date,release_status,created_id,created_at,updated_id,updated_at,admin_note,shoppinglist_remarks,precooking_remarks,cooking_remarks,one_day_schedule_algorithm,pre_cooking_schedule_algorithm,cooking_schedule_algorithm
10777,1,16375,牛もやし丼献立,下味をつけた牛肉でごはんが進む丼です。三色ナムルは電子レンジでお手軽です,"",2017-03-17,2,3,2017-03-09 11:37:50,3,2017-03-14 10:13:43,"",,,,,,
10778,1,16376,椎茸の肉詰め献立,春の食材を食卓にお届けします。春の椎茸も美味しいですよ,"",2017-03-18,2,3,2017-03-09 11:56:37,3,2017-03-14 10:12:51,"",,,,,,
10779,1,16377,キャベツとハムの春巻き献立,ハムとチーズが入った人気の春巻きです。サッパリした副菜を添えて,"",2017-03-19,2,3,2017-03-09 12:15:39,3,2017-03-14 10:12:00,"",,,,,,
10780,1,16378,牡蠣のスモークサーモン巻ソテー献立,旨味が詰まった食材の組合せのソテーです。瑞々しいサラダもご一緒に,"",2017-03-20,2,3,2017-03-09 12:20:12,3,2017-03-14 10:10:59,"",,,,,,
10781,1,16403,簡単！おあげのハンバーグあんかけ献立,優しい味のあんかけが絡んだハンバーグです。あんかけは春らしく菜の花入りです,"",2017-03-21,2,3,2017-03-09 16:54:57,3,2017-03-14 10:09:56,"",,,,,,
10782,1,16405,カイワレと牛肉のささっと炒め献立,セロリの香りが爽やかな炒め物です。さっぱり春雨サラダもご一緒に,"",2017-03-22,2,3,2017-03-09 17:04:24,3,2017-03-14 10:08:39,"",,,,,,
10783,1,16406,じゃこと梅の混ぜご飯献立,炊きたてごはんにじゃこと梅干しを混ぜるだけで食欲をそそります。生わかめは今が旬です,"",2017-03-23,2,3,2017-03-09 17:09:11,3,2017-03-14 10:07:58,"",,,,,,
10784,1,16578,お手軽牛丼献立,牛肉の下処理が美味しさの決め手です。小松菜のお手軽副菜もご一緒に,"",2017-03-24,2,3,2017-03-14 08:49:37,3,2017-03-14 10:06:49,"",,,,,,
10785,1,15723,ブリと野菜のトマト煮献立,ブリをトマト味で煮込んだレシピです。食べ応え充分なサラダもご一緒に,"",2017-03-25,2,3,2017-03-14 09:17:33,3,2017-03-14 10:04:20,"",,,,,,
10786,1,16579,アスパラとベーコンのパスタ献立,アスパラが美味しい季節に相応しいパスタです。香り豊かなコンソメスープもご一緒に,"",2017-03-26,2,3,2017-03-14 09:28:00,3,2017-03-14 10:03:01,"",,,,,,
10787,1,16580,鶏の照り焼きごま風味献立,仕上げにごまを振ることで風味が良くなります。ツナの旨味がきいた煮物を添えて,"",2017-03-27,2,3,2017-03-14 09:33:09,3,2017-03-14 10:01:22,"",,,,,,
10788,1,16581,白身魚のホイル焼き献立,魚介と玉ねぎ、椎茸の旨味がホイルの中でコラボします。今が旬の鯛がお薦めです,"",2017-03-28,2,3,2017-03-14 09:37:30,3,2017-03-14 10:00:31,"",,,,,,
10789,1,16582,ポークステーキ献立,ポークステーキのソースは玉ねぎのすりおろしが決め手です。バジル風味の副菜もご一緒に,"",2017-03-29,2,3,2017-03-14 09:41:14,3,2017-03-14 09:55:46,"",,,,,,
10790,1,6122,きゅうりと豚しゃぶのサラダ献立,豚しゃぶサラダはお子様にも人気レシピです。副菜の肉味噌は色々と使えます,"",2017-03-30,2,3,2017-03-14 09:53:07,3,2017-03-14 09:54:10,"",,,,,,
10791,1,17010,麻婆豆腐献立,定番の麻婆豆腐を手作りします。さっぱり副菜もご一緒に,"",2017-03-31,2,3,2017-03-27 08:42:33,3,2017-03-28 11:25:26,"",,,,,,
10792,1,17011,金目鯛とごぼうの含め煮献立,4月より新しい生活を送られる方々へのおめでたいレシピです。酢の物もご一緒に,"",2017-04-01,2,3,2017-03-27 08:47:18,9,2017-04-05 09:03:10,"",,,,,,
10793,1,17016,トンカツ献立,休日にはサクサク衣の揚げたてを作りませんか。野菜たっぷりの副菜もご一緒に,"",2017-04-02,2,3,2017-03-27 11:40:37,3,2017-03-28 11:26:08,"",,,,,,
10794,1,17017,甘塩鮭のソテー黒酢ソース添え献立,黒酢ソースが食欲をそそるソテーです。食べ応えのあるサラダを添えて,"",2017-04-03,2,5,2017-03-27 12:12:35,3,2017-03-28 11:26:19,"",,,,,,
10795,1,17018,ボンゴレ・ロッソ献立,あさりの美味しいパスタです。セロリの食感が良いサラダもご一緒に,"",2017-04-04,2,5,2017-03-27 12:14:59,3,2017-03-28 11:26:31,"",,,,,,
10796,1,17023,豆腐バーグきのこあんかけ献立,豆腐バーグにあんかけをかけたヘルシーなレシピです。副菜はレンジで簡単です,"",2017-04-05,2,3,2017-03-27 15:59:21,3,2017-03-28 11:26:41,"",,,,,,
10797,1,17024,豚の生姜焼き献立,定番の生姜焼きはstillたれを使って簡単に出来ます。じゃがいも明太はレンジでお手軽です,"",2017-04-06,2,3,2017-03-27 16:10:38,9,2017-04-06 11:38:55,"",,,,,,
10798,1,17027,ポテトグラタン献立,ホワイトソースで人気のグラタンです。カットして盛り付けるだけのサラダもご一緒に,"",2017-04-07,2,3,2017-03-27 16:16:43,3,2017-03-28 11:27:11,"",,,,,,
10799,1,17028,チキンナゲット献立,ご家庭でチキンナゲットを作ってみませんか。食べ応えのあるマリネを添えて,"",2017-04-08,2,3,2017-03-27 16:23:15,3,2017-03-28 11:27:22,"",,,,,,
10800,1,14093,白身魚のとろーりモッツァレラチーズ鍋献立,魚にこんがり焼き目をつけてからトマトソースで煮ます。ワインが合いそうですね,"",2017-04-09,2,3,2017-03-27 16:30:22,9,2017-04-26 14:31:56,"",,,,,,
10801,1,17029,野菜たっぷり塩焼きそば献立,塩味の野菜をたっぷり使ったやきそばです。スープもお手軽に使えます,"",2017-04-10,2,3,2017-03-27 16:36:27,3,2017-03-28 11:27:44,"",,,,,,
10802,1,17030,鶏肉の黒酢炒め献立,フライパンで出来る人気の黒酢炒めです。香り爽やかなスープもご一緒に,"",2017-04-11,2,3,2017-03-27 16:40:26,3,2017-03-28 11:27:57,"",,,,,,
10803,1,17031,鯖の甘酢から揚げ献立,揚げた鯖を甘酢に漬け込んだお弁当にも使えるレシピです。副菜で野菜を補います,"",2017-04-12,2,3,2017-03-27 16:44:49,3,2017-03-28 11:28:09,"",,,,,,
10804,1,17033,そぼろご飯献立,今日の献立はそのままお弁当に出来ます。大豆入りのきんぴらはお薦めです,"",2017-04-13,2,3,2017-03-27 17:16:05,3,2017-03-29 14:44:51,"",,,,,,
10805,1,17078,ほうれん草とベーコンのパスタ献立,ほうれん草とベーコンの定番パスタです。副菜の味付けはstillたれで簡単ですよ,"",2017-04-14,2,3,2017-03-29 14:46:09,9,2017-04-11 09:57:41,"",,,,,,
10806,1,17085,豚肉の肉団子カレー塩献立,カレー塩で食べる肉団子です。野菜たっぷりのスープもご一緒に,"",2017-04-15,2,3,2017-03-29 15:03:44,9,2017-04-11 09:57:56,"",,,,,,
10807,1,17090,イカとニラのチヂミ献立,旬のニラを使ったチヂミです。アルコールが進みますね,"",2017-04-16,2,3,2017-03-29 15:20:23,9,2017-04-11 09:58:09,"",,,,,,
10808,1,17104,鮭とほうれん草のオムレツ献立,具材がたっぷり入ったオムレツです。副菜はヨーグルトサラダをどうぞ,"",2017-04-17,2,3,2017-03-29 16:16:41,9,2017-04-11 09:58:21,"",,,,,,
10809,1,17110,スパイシー春巻き献立,カレー風味の揚げ春巻きです。ピーナッツ和えで野菜を摂ります,"",2017-04-18,2,3,2017-03-29 16:37:52,9,2017-04-11 09:58:41,"",,,,,,
10810,1,17283,鶏のから揚げといんげんの甘辛献立,生姜風味の甘辛い味でご飯が進みます。野菜たっぷりの味噌汁とご一緒に,"",2017-04-19,2,3,2017-03-30 11:31:30,9,2017-04-11 09:58:54,"",,,,,,
10811,1,17328,牛肉と舞茸のスタミナ炒め献立,舞茸はお肉を軟らかくします。お肉でスタミナを付けて今週を乗り切りましょう,"",2017-04-20,2,9,2017-04-03 14:21:47,9,2017-04-14 10:33:46,"",,,,,,
10812,1,17317,さわらのごま酢焼き献立,さっぱりとしたタレで漬け込んで焼くだけ。ボリュームのあるサラダでおなかも満足です,"",2017-04-21,2,9,2017-04-04 10:43:17,9,2017-04-14 10:33:26,"",,,,,,
10813,1,17329,豚肉ともやしの中華炒め献立,もやしはさっと炒めてシャキシャキ感を楽しみましょう。煮物はレンジでお手軽に,"",2017-04-22,2,9,2017-04-04 10:54:40,9,2017-04-14 10:33:04,"",,,,,,
10814,1,17320,チキンカレー献立,久しぶりにカレーはいかがですか？ブロッコリーはヨーグルトを使ったソースでさっぱりと,"",2017-04-23,2,9,2017-04-04 11:07:48,9,2017-04-11 09:59:41,"",,,,,,
10815,1,17336,豚肉の黒こしょう焼き献立,豚肉はしっかり焼き付けることで食欲をそそります。もずくのスープと共にどうぞ,"",2017-04-24,2,9,2017-04-04 11:19:29,9,2017-04-14 10:32:28,"",,,,,,
10816,1,17324,ふんわりつくね献立,ふんわりつくねは柚子こしょうがかくし味。レンコンはピリ辛にするのもオススメです,"",2017-04-25,2,9,2017-04-04 11:29:41,9,2017-04-14 10:32:07,"",,,,,,
10817,1,17334,牛肉と野菜のおかずマリネ献立,白いご飯にもお酒の肴にもピッタリの一品。すぐできて美味しいあっさり漬けとご一緒にどうぞ,"",2017-04-26,2,9,2017-04-04 13:48:15,9,2017-04-14 10:31:48,"",,,,,,
10818,1,17126,スモークサーモンとほうれん草のフィットチーネ献立,春らしく彩りの華やかなパスタです。ピリ辛のサラダを添えて,"",2017-04-27,2,9,2017-04-04 13:58:09,9,2017-04-11 10:00:28,"",,,,,,
10819,1,17717,味わいたっぷり豚丼献立,食べ応えのある甘辛い丼とサッパリした和え物が良く合います。温かいお味噌汁とご一緒に,"",2017-04-28,2,9,2017-04-12 16:50:07,9,2017-04-21 10:54:09,"",,,,,,
10820,1,17727,海鮮サラダ献立,シャキシャキ野菜を楽しみましょう。たんぱく質豊富な副菜と合わせました,"",2017-04-29,2,9,2017-04-14 10:30:34,9,2017-04-21 10:54:20,"",,,,,,
10821,1,3948,鶏の照り焼きと焼き野菜献立,焼き野菜を添えて彩りも鮮やかに。優しい味わいのコーンスープもオススメです,"",2017-04-30,2,9,2017-04-14 11:53:00,9,2017-04-21 10:54:29,"",,,,,,
10822,1,17734,筍とブロッコリーのパスタ献立,シンプルに春の香りを感じるパスタです。蒸し鶏はコクのある味噌マヨソースで,"",2017-05-01,2,9,2017-04-14 14:51:52,9,2017-04-21 10:54:40,"",,,,,,
10823,1,17735,レンジでスコッチエッグ献立,レンジで手軽にできるスコッチエッグをご紹介します。食卓が華やかになる一品です,"",2017-05-02,2,9,2017-04-14 15:05:01,9,2017-04-21 10:54:48,"",,,,,,
10824,1,17736,ポテト＆ベーコンオムレツ献立,ポテトとベーコンを添えたオムレツです。サラダはグレープフルーツで爽やかな仕上がり,"",2017-05-03,2,9,2017-04-14 15:21:07,9,2017-04-21 10:54:56,"",,,,,,
10825,1,17737,炒飯献立,人気の炒飯に豆腐の炒め物を合わせました。もやしのシャキシャキ感を楽しみましょう,"",2017-05-04,2,9,2017-04-14 15:33:50,9,2017-04-21 10:55:03,"",,,,,,
10826,1,17738,クリスピーロールカツ献立,コーンフレークを衣に使ったクリスピーロールカツ。サクサクした食感がオススメです,"",2017-05-05,2,9,2017-04-14 15:53:02,9,2017-04-21 10:55:11,"",,,,,,
10827,1,17749,さわらのめんたいマヨ焼き献立,ピリ辛がアクセントの和風献立です。きゅうりの辛子漬けはおつまみにもオススメ,"",2017-05-06,2,9,2017-04-14 16:09:07,9,2017-04-21 10:55:24,"",,,,,,
10828,1,17752,ブロッコリーと牛肉の中華炒め献立,ゴールデンウイークは楽しめましたか？色鮮やかなブロッコリーは栄養豊富でオススメです,"",2017-05-07,2,9,2017-04-14 16:23:32,9,2017-04-21 10:55:34,"",,,,,,
10829,1,17753,トマトと卵のボリューム炒め献立,連休明けの方も多いでしょうか？たっぷりのトマトでボリュームのある炒め物です,"",2017-05-08,2,9,2017-04-14 16:42:16,9,2017-04-21 10:55:41,"",,,,,,
10830,1,17754,おからハンバーグ献立,おからを使った優しい味わいのハンバーグです。ご飯がすすむピリ辛の副菜とご一緒にどうぞ,"",2017-05-09,2,9,2017-04-14 16:55:14,9,2017-04-21 10:55:49,"",,,,,,
10831,1,18025,鶏と野菜の甘酢からめ献立,鶏肉と野菜が甘酢と絡まり、ご飯がすすむ一品です。栄養バランスも良くお弁当のおかずとしてもおすすめですよ,"",2017-05-10,2,9,2017-04-19 09:37:04,9,2017-04-21 10:55:58,"",,,,,,
10832,1,18029,ポークピカタ献立,チーズをサンドしたポークピカタです。バターの風味が食欲をそそる副菜とご一緒に,"",2017-05-11,2,9,2017-04-19 09:49:41,9,2017-04-21 10:57:06,"",,,,,,
10833,1,18080,チキンのハーブグリル献立,ハーブが食欲を刺激する一品です。今が旬のほくほくのじゃがいもを添えて,"",2017-05-12,2,9,2017-04-20 10:22:22,9,2017-04-21 10:57:16,"",,,,,,
10834,1,6546,肉コロうどん献立,週末に麺類はいかがですか？生姜を効かせたオススメのレシピです,"",2017-05-13,2,9,2017-04-20 10:36:13,9,2017-04-21 10:57:40,"",,,,,,
10835,1,18086,鮭と野菜の甘辛ねぎソース献立,カラリと揚がった鮭と野菜にねぎソースがよく合います。カレー粉を効かせたスープとご一緒に,"",2017-05-14,2,9,2017-04-20 10:49:16,9,2017-04-21 10:57:49,"",,,,,,
10836,1,18089,豚肉の長芋梅巻き献立,長芋と梅干しは幅広く人気のある組合せですね。キャベツの甘みを感じる優しい味わいのスープと共に,"",2017-05-15,2,9,2017-04-20 11:31:05,9,2017-04-21 10:57:56,"",,,,,,
10837,1,18090,牛肉とピーマンの細切り炒め献立,ピーマンと筍のシャキシャキ食感を楽しみましょう。ピリ辛の副菜を合わせました,"",2017-05-16,2,9,2017-04-20 11:39:02,9,2017-04-21 10:58:08,"",,,,,,
10838,1,18091,かつおのマリネ献立,初夏の日差しも時折感じる季節ですね。初鰹をマリネでいただきましょう,"",2017-05-17,2,9,2017-04-20 11:54:06,9,2017-04-21 10:58:16,"",,,,,,
10839,1,18092,鶏のから揚げバルサミコソース献立,コクのあるバルサミコソースが鶏肉とよく合います。爽やかな風味のサラダもご一緒にどうぞ,"",2017-05-18,2,9,2017-04-20 12:00:04,9,2017-04-21 10:58:24,"",,,,,,
10840,1,4301,エビ入りトマトのクリームパスタ献立,クリーミーなトマトのパスタです。副菜のサラダはアーモンドスライスがアクセントに,"",2017-05-19,2,9,2017-04-20 12:16:07,9,2017-04-21 10:58:32,"",,,,,,
10841,1,18097,豚のキムチ炒め献立,週末はパンチの効いたキムチ炒めをいかがですか。副菜は生姜ソースでさっぱりと,"",2017-05-20,2,9,2017-04-20 13:29:04,9,2017-04-21 10:58:40,"",,,,,,
10842,1,18099,オムライス献立,定番の人気メニュー、オムライス。カレー風味のごぼうサラダはシャキシャキの歯ごたえを楽しんで,"",2017-05-21,2,9,2017-04-20 13:32:33,9,2017-04-21 10:58:48,"",,,,,,
10843,1,18108,麻婆ナス献立,ご飯のお供にピッタリの麻婆ナスです。さっぱり食べられる和え物とご一緒に,"",2017-05-22,2,9,2017-04-20 13:51:40,9,2017-04-21 10:58:56,"",,,,,,
10844,1,18112,ねぎじゃがつくね献立,素朴な味わいのおやきのようなねぎじゃがつくねです。彩り豊かなサラダとご一緒にどうぞ,"",2017-05-23,2,9,2017-04-20 13:57:45,9,2017-04-21 10:59:04,"",,,,,,
10845,1,18115,マグロとアボカド寿司献立,マグロとアボカドのお寿司です。彩りも綺麗ですね,"",2017-05-24,2,9,2017-04-20 14:44:45,9,2017-04-21 10:59:11,"",,,,,,
10846,1,18116,鶏のから揚げ献立,みんなが大好きなメニュー、鶏のから揚げです。副菜にはサッパリ食べられる即席漬けを合わせました,"",2017-05-25,2,9,2017-04-20 15:47:01,9,2017-04-21 10:59:19,"",,,,,,
10847,1,19013,四川風串焼き献立,タレを塗ってこんがりとグリルするピリ辛の串焼きです。優しい味の胡麻味噌和えとご一緒にどうぞ,"",2017-05-26,2,9,2017-05-15 09:28:26,9,2017-05-22 11:32:30,"","","","",,,
10848,1,19014,豚肉とオクラのチャンプルー献立,オクラはたんぱく質の消化吸収を助けるのでチャンプルーにピッタリ。さっと炒めて色鮮やかに,"",2017-05-27,2,9,2017-05-15 09:52:18,9,2017-05-22 11:32:39,"","","","",,,
10849,1,19015,エビのマヨネーズソース献立,プリプリなエビの食感をお楽しみください。副菜はおつまみにもオススメですよ,"",2017-05-28,2,9,2017-05-15 09:59:43,9,2017-05-22 11:32:49,"","","","",,,
10850,1,19016,鶏ささみの梅肉巻き献立,レンジで手軽にできるオススメのレシピです。ささみと梅干しの相性もバツグンです,"",2017-05-29,2,9,2017-05-15 10:13:07,9,2017-05-22 11:32:58,"","","","",,,
10851,1,19017,野菜たっぷりスペイン風オムレツ献立,チーズと野菜たっぷりのオムレツです。サラダはハチミツ入りのヨーグルトソースでサッパリと,"",2017-05-30,2,9,2017-05-15 10:23:23,9,2017-05-22 11:33:10,"","","","",,,
10852,1,19018,still風ビビンバ献立,週の真ん中に丼物はいかがですか？コチュジャンをきかせると食欲も増しそうです,"",2017-05-31,2,9,2017-05-15 10:31:30,9,2017-05-22 11:33:18,"","","","",,,
10853,1,19051,千切り野菜で食べる鯖の唐揚げ献立,セロリの風味が爽やかな一品です。ボリュームもたっぷり,"",2017-06-01,2,9,2017-05-15 11:05:15,9,2017-05-22 11:33:28,"","","","",,,
10854,1,19020,蒸し鶏の肉味噌かけ献立,レンジを使った蒸し鶏の肉味噌かけです。歯ごたえの良いクラゲの酢の物でサッパリと,"",2017-06-02,2,9,2017-05-15 11:52:00,9,2017-05-22 11:33:36,"","","","",,,
10855,1,19052,きのこのパスタ献立,きのこたっぷりのシンプルなパスタです。アボカドのディップを添えてちょっとお洒落に,"",2017-06-03,2,9,2017-05-15 12:04:39,9,2017-05-22 11:33:44,"","","","",,,
10856,1,19023,ハンバーグのトマトソース煮献立,お子様も大好きなハンバーグレシピです。トマトソースでリコピンもたっぷり,"",2017-06-04,2,9,2017-05-15 12:16:49,9,2017-05-22 11:33:52,"","","","",,,
10857,1,19053,サーモンのハーブグリル献立,ローズマリーの香りが爽やかな一品です。梅雨時のジメジメ感を吹き飛ばしましょう,"",2017-06-05,2,9,2017-05-15 13:20:12,9,2017-05-22 11:34:02,"","","","",,,
10858,1,19026,ナスの肉巻き献立,ナスをお肉で巻いているので食べ応えがあります。お弁当、おつまみにもピッタリです,"",2017-06-06,2,9,2017-05-15 13:49:36,9,2017-05-22 11:34:10,"","","","",,,
10859,1,19054,ゆで豚サラダ献立,もやしのシャキシャキ感を楽しみましょう。胡麻油の香りがポイントです,"",2017-06-07,2,9,2017-05-15 14:39:01,9,2017-05-22 11:34:18,"","","","",,,
10860,1,11978,鶏肉のスパイス焼き献立,鶏肉にカレー粉などで下味をつけて焼きます。スパイシーな香りが食欲をそそります,"",2017-06-08,2,9,2017-05-15 14:44:51,9,2017-05-22 11:34:26,"","","","",,,
10861,1,19652,アボカドと鮭のクリーミーグラタン献立,久しぶりにグラタンはいかがですか？ホクホクのアボカドにチーズが良く合います。,"",2017-06-09,2,9,2017-05-30 10:10:47,5,2017-06-06 15:30:18,"","","","",,,
10862,1,19655,牛丼献立,甘辛い味付けはご飯によく合いますね。生姜でさっぱりいただける蒸しナスとご一緒に,"",2017-06-10,2,9,2017-05-30 10:23:43,5,2017-06-06 15:30:46,"","","","",,,
10863,1,19656,ごろごろトマトのソースカツ献立,サクサクに揚げたトンカツにミニトマトのソースをかけていただきます。食べ応えがありますよ,"",2017-06-11,2,9,2017-05-30 10:25:58,5,2017-06-06 15:31:02,"","","","",,,
10864,1,19663,台湾風鶏の卵つけ焼き献立,下味をつけた鶏肉を卵にくぐらせてから焼きます。しっかりこしょうを利かせるのがオススメ,"",2017-06-12,2,9,2017-05-30 10:47:18,5,2017-06-06 15:31:23,"","","","",,,
10865,1,19658,豚肉とアスパラ炒め献立,胡麻油の香りが食欲をそそる一品です。サッパリいただけますよ,"",2017-06-13,2,9,2017-05-30 11:20:58,5,2017-06-06 15:31:46,"","","","",,,
10927,1,21802,スパイシー春巻き献立,カレー風味のスパイシー春巻きはいかがですか,"",2017-08-14,2,11,2017-07-06 16:59:29,11,2017-08-01 09:51:01,"","","","",,,
10866,1,19664,ほうれん草のエビ入りソテー献立,ぷりぷりのエビとふわふわの卵がやさしい味わいです。コクのある肉味噌豆腐とご一緒に,"",2017-06-14,2,9,2017-05-30 11:37:11,5,2017-06-06 15:32:05,"","","","",,,
10867,1,19660,鶏もも肉の甘味噌焼き献立,鶏もも肉を白味噌と甘酒に浸けて焼くだけの簡単レシピです。お弁当のおかずにもピッタリですよ,"",2017-06-15,2,9,2017-05-30 11:46:14,5,2017-06-06 15:32:21,"","","","",,,
10868,1,19661,きのことイカのガーリック炒め献立,ガーリックをきかせた炒め物はお酒にも合いますね。週末をゆっくりお過ごし下さい,"",2017-06-16,2,9,2017-05-30 11:50:32,5,2017-06-06 15:32:37,"","","","",,,
10869,1,19662,アマトリチャーナ献立,シンプルなトマトソースのパスタです。ゴーヤのサラダは辛子酢味噌でさっぱりと,"",2017-06-17,2,9,2017-05-30 11:54:48,5,2017-06-06 15:32:58,"","","","",,,
10870,1,3467,しし唐の豚肉巻き献立,豚ばら肉をしし唐にクルクル巻いています。Stillたれの味付けでご飯がとってもすすみますよ,"",2017-06-18,2,9,2017-05-30 12:16:18,5,2017-06-06 15:33:11,"","","","",,,
10871,1,15507,油琳鶏献立,カラリと二度揚げした鶏肉に甘酸っぱいタレをかけていただきます。ボリュームのある一品です,"",2017-06-19,2,9,2017-05-30 13:35:03,5,2017-06-06 15:33:26,"","","","",,,
10872,1,19667,ズッキーニのハンバーグ献立,ズッキーニを巻いて焼いたハンバーグです。バジル風味のマカロニサラダとご一緒に,"",2017-06-20,2,9,2017-05-30 13:45:39,5,2017-06-06 15:33:42,"","","","",,,
10873,1,19668,豚とキャベツのしゃぶしゃぶ献立,stillたれを使ったごまダレでしゃぶしゃぶをいただきましょう。副菜は緑黄色野菜をたっぷりと,"",2017-06-21,2,9,2017-05-30 14:03:13,5,2017-06-06 15:34:22,"","","","",,,
10874,1,19669,鯵のフライ献立,今が旬の鯵をフライにしていただきます。お魚のパワーで暑さに負けない体を作りましょう,"",2017-06-22,2,9,2017-05-30 14:21:41,5,2017-06-06 15:34:11,"","","","",,,
10875,1,12412,チキンと白菜のクリーム煮献立,鶏むね肉を使ったクリーム煮です。味噌を隠し味として入れるとコクが出て美味しいですよ,"",2017-06-23,2,9,2017-06-15 09:23:57,9,2017-06-19 10:03:08,"","","","",,,
10876,1,20329,にんにくチャーハン献立,にんにくの香りが食欲をそそるチャーハンです。しっかり食べて疲労回復を目指しましょう,"",2017-06-24,2,9,2017-06-15 09:46:11,9,2017-06-19 10:03:49,"","","","",,,
10877,1,20333,トマトとちりめんじゃこのオムレツ献立,ちりめんじゃことチーズの入ったオムレツです。カルシウムをたっぷり摂れてオススメです,"",2017-06-25,2,9,2017-06-15 10:12:25,9,2017-06-19 10:04:21,"","","","",,,
10878,1,20334,鯖の韓国風みそ煮献立,電子レンジで作る韓国風の鯖の味噌煮です。ピリ辛味でごはんが進みますよ,"",2017-06-26,2,9,2017-06-15 10:23:31,9,2017-06-19 10:04:52,"","","","",,,
10879,1,20335,長芋の肉巻献立,長いもに豚肉を巻き付けてこんがりと焼きます。Stillたれを使ったおすすめレシピです,"",2017-06-27,2,9,2017-06-15 10:32:24,9,2017-06-19 10:05:18,"","","","",,,
10880,1,20336,鶏肉とブロッコリーのこってり炒め献立,ボリュームがあって食べ応えのあるおすすめレシピです。さっぱり味の副菜とご一緒にいかがですか,"",2017-06-28,2,9,2017-06-15 10:42:55,9,2017-06-19 10:05:50,"","","","",,,
10881,1,20337,プルコギ献立,リンゴジュースとハチミツが隠し味のプルコギです。生姜の効いたなすの和え物ともよく合いますよ,"",2017-06-29,2,9,2017-06-15 10:53:55,9,2017-06-19 10:06:16,"","","","",,,
10882,1,20338,オムそば献立,週末ですね。ソース味が恋しくなりませんか？お子様にも人気のオムそばをどうぞ,"",2017-06-30,2,9,2017-06-15 11:15:23,9,2017-06-19 10:06:48,"","","","",,,
10883,1,20343,ニラと豆腐の帆立あん仕立て献立,旨味たっぷりのホタテの水煮缶を汁ごと使いました。ホッとする優しい味のあんかけです,"",2017-07-01,2,9,2017-06-15 12:09:55,9,2017-06-19 10:07:28,"","","","",,,
10884,1,20344,鶏の照り焼き献立,鶏の照り焼きの調味料はstillたれだけで簡単です。お弁当のおかずにもピッタリですよ,"",2017-07-02,2,9,2017-06-15 12:16:05,9,2017-06-19 10:08:19,"","","","",,,
